{
  "SchemaVersion": 1,
  "Png": "diagram.png",
  "Svg": "diagram.svg",
  "Report": "validation-summary.json",
  "ValidationReportSha256": "3333333333333333333333333333333333333333333333333333333333333333",
  "IssueCount": 1,
  "ExportedCount": 1,
  "SkippedCount": 0,
  "Crops": [
    {
      "Gate": "rendered-labels",
      "Element": "node-1",
      "Type": "node-label-outside-shape",
      "Status": "EXPORTED",
      "Path": "crops/001-node-1-node-label-outside-shape.png",
      "PixelBounds": { "X": 10, "Y": 20, "Width": 160, "Height": 160 }
    }
  ]
}
